,id_not,title,description,pubDate,link,category,medium
23,31,Abogados de Saab dicen que él no ha cooperado con EEUU | El Heraldo,"La defensa del empresario colombiano Alex Naim Saab Morán, supuesto testaferro del presidente venezolano Nicolás Maduro, acusaron a EE. UU. de “falsedad integral” en su solicitud a Cabo Verde de facilitar su extradición, la cual ya fue avalada por el Gobierno del país africano y cuya última palabra la tiene la Justicia de ese país.
Según la impugnación presentada contra la decisión del Gobierno caboverdiano de autorizar la extradición de Saab, los abogados del empresario alegaron que Estados Unidos violó “el principio de lealtad penal” en el proceso que inició cuando Saab fue detenido el pasado 12 de junio. Ese día, su avión hizo escala para repostar en el Aeropuerto Internacional Amilcar Cabral de la isla de Sal, y allí fue capturado en respuesta a una petición de EE. UU., cursada a través de Interpol, por presunto lavado de activos a favor del régimen en Venezuela.
Desde entonces, Saab ha estado preso en Cabo Verde y su defensa –que ha presentado algunos cambios contundentes– ha interpuesto, uno tras otro, recursos para evitar la extradición a EE. UU.
El más reciente fue este mes, cuando los abogados de Saab radicaron un recurso de amparo ante el Tribunal Constitucional de Cabo Verde, así como un recurso de oposición a la autorización dada por el Ejecutivo a la extradición, interpuesto ante el Tribunal de Apelaciones de Barlavento, con sede en la isla de San Vicente, el cual debe tomar la decisión final.
En el recurso de oposición, los abogados sostienen que “los actos imputados” a Saab, contenidos en “la solicitud (de extradición) firmada por la Procuraduría General de la República de Cabo Verde y en los documentos entregados por Estados Unidos son todos falsos”.
La defensa afirmó que la idea de que el empresario colaboró y proporcionó a agentes de EE. UU. pruebas de sus supuestos delitos, como figura en la petición de extradición, es una “maniobra irrazonable para poner la extradición en ruta de colisión con Venezuela”.
El retrato de un “traidor”
Asimismo, los letrados acusaron a Washington de ofrecer un retrato de Saab “como traidor, cooperador y colaborador”, en “violación del principio de lealtad en los procesos penales”, pues el proceso de extradición en curso en Cabo Verde “es una prueba” de que su cliente “nunca ha brindado cooperación o colaboración a Estados Unidos”.
Indicaron que otra evidencia de la “falsedad” de esa supuesta cooperación es que, para ser verdad, el empresario “habría recibido un estatus especial, no sólo para él, sino para toda la familia”, que ya habrían sido “integrados en un programa de protección de testigos”.
“Nada de esto ha ocurrido”, aseguraron los abogados en el escrito. “Por el contrario, en los documentos entregados por EE. UU., la pena por delitos penales atribuidos en la extradición es de 20 años de prisión por cada uno de los cargos de la acusación”, lo que totalizaría “una pena máxima de 160 años” de cárcel.
El documento enfatiza que “los hechos reportados como ocurridos en Florida nunca han tenido lugar” y que Saab “nunca ha cometido ningún acto en territorio de Estados Unidos”.
En ese sentido, los abogados de Alex Saab rechazan la intención de EE. UU. de actuar más allá de su jurisdicción nacional, reclamando el derecho, con base en una supuesta “jurisdicción universal”, de arrestar y juzgar a ciudadanos extranjeros que residen en otros países por presuntos actos cometidos fuera del país norteamericano.
“Maduro no puede nombrarlo diplomático”. Tras la detención del empresario, Venezuela señaló que Saab es un ciudadano venezolano y un “agente”del Gobierno, que se hallaba “en tránsito” en Cabo Verde para regresar al país.
Con base en ello, la defensa ha dicho en varias ocasiones que Saab “tenía derecho a la inviolabilidad personal como enviado especial de Venezuela en tránsito por Cabo Verde”.
Sin embargo, este lunes el presidente del Tribunal Supremo de Justicia de Venezuela en el exilio, Miguel Ángel Martín, envió una carta a la ministra de Justicia de Cabo Verde, Janine Santos, en la que le advierte de la “ilegitimidad” de Nicolás Maduro para otorgar carácter de agente diplomático a Saab.
“La ilegitimidad de Nicolás Maduro Moros deriva del acto realizado de este alto tribunal en sentencia condenatoria del 15 de agosto de 2018 en juicio criminal relacionado con las contrataciones de obras públicas con la empresa Odebrecht”, se lee en la misiva.
Agrega que “no existe impedimento legal para la extradición de Alex Saab a Estados Unidos para que enfrente tales acusaciones, así como las resultas de las investigaciones que se adelantan por las conexiones con el narcotráfico y grupos terroristas como las FARC, ELN y Hezbolá, que tienen bases de operaciones en territorio venezolano”.",2020-07-28 12:29:41+00:00,https://www.elheraldo.co/judicial/abogados-de-saab-dicen-que-el-no-ha-cooperado-con-eeuu-745911,Judicial,El Heraldo
24,32,Incendio consume una carpintería en Chiquinquirá | El Heraldo,"El Cuerpo de Bomberos de Barranquilla atendió la mañana de este viernes un incendio que se generó en el interior de una carpintería ubicada en la carrera 33 con calle 45, en el barrio Chiquinquirá.
Alberto Lobo Cepeda, de 66 años y dueño de la carpintería, señaló que la conflagración se originó cerca de las 7:45 de la mañana y al parecer su origen estaría relacionado con un corto circuito. Las llamas consumieron en su totalidad el local, 
Hasta el lugar de los hechos llegaron dos máquinas de bomberos con varios uniformados quienes, en cuestión de minutos, lograron sofocar las llamas y evitaron que se trasladara a casas vecinas.
“Hubo mucho temor por parte de los vecinos ya que las llamas alcanzaron grandes alturas y el material que estaba en el interior de la carpintería era muy inflamable. Había por supuesto mucha madera, pinturas, espuma de mueblería, telas y demás químicos”, contó un testigo a este medio.
Otras personas indicaron que el humo, debido a que era muy tóxico, afectó a varios adultos mayores y niños, por lo que fueron atendidos por varios paramédicos.
Por su parte, Lobo Cepeda, el dueño del local, calcula que las pérdidas materiales, entre muebles y maquinaria, están valoradas en casi 300 millones de pesos.",2020-07-31 16:30:39+00:00,https://www.elheraldo.co/judicial/incendio-consume-una-carpinteria-en-chiquinquira-746859,Judicial,El Heraldo
25,33,Otras personas estarían vinculadas al crimen del abogado en Cartagena: Policía  | El Heraldo,"Como José Luis Pastrana Llanos, alias el Pastrana, de 27 años,  y Erick Andrés Berrio Espitia, alias el Pichui, de 28 años, fueron identificados los dos hombres que fueron capturados la tarde del jueves en Cartagena, por ser presuntamente autores materiales del asesinato de Sergio Andrés Díaz Barrios, un abogado, registrador auxiliar de la ciudad, en hechos ocurridos el pasado 16 de julio, en el barrio Los Alpes, en el suroriente de la capital de Bolívar.
En rueda de prensa la mañana de este viernes, alcalde de Cartagena, William Dau Chamat y el comandante de la Mecar, general Henry Sanabria Cely, ofrecieron  detalles de la investigación que llevó a la captura de los hombres.
En la intervención, el alto oficial señaló  que los móviles del homicidio no fue el atraco, sino que estaría relacionado “con la actividad que desarrollaba el abogado”
“Se analizaron los videos y se observa como el conductor de la moto obtiene un elemento en específico. Así mismo, se continúa con las investigaciones para establecer con certeza la identidad de las personas que habrían coparticipado en el homicidio, en calidad de determinadores, por cuanto más allá del hurto existiría un móvil distinto que involucraría otras personas”, detalló el general Sanabria.
Por su parte, el mandatario cartagenero destacó que las acciones de captura se lograron “por la participación de la comunidad que fue vital para dar con los perpetradores”.
En operativos simultáneos, ejecutados en vías principales de los barrios 13 de junio y el sector El Porvenir del barrio Olaya Herrera, policías de la Seccional de Investigación Criminal e Interpol, bajo la coordinación de la Fiscalía 51 Seccional URI, fueron quienes lograron la captura.
“Las labores investigativas, recolección de información, elementos materiales probatorios y análisis de videos de cámaras de seguridad, fueron suficientes para que se expidieran por parte del juzgado 16 Penal Municipal con funciones de control de garantías, las órdenes de captura en contra de los hombres, quienes serían los autores del homicidio”, señaló la institución en un comunicado. .
‘El Pastrana’ y  ‘Pichui’ fueron puestos a disposición de la Fiscalía, para iniciar las audiencias preliminares ante un juez de control de garantías.",2020-07-31 17:10:45+00:00,https://www.elheraldo.co/judicial/otras-personas-estarian-vinculadas-al-crimen-del-abogado-en-cartagena-policia-746866,Judicial,El Heraldo
26,34,En video | Incendio consume una carpintería en Chiquinquirá | El Heraldo,"El Cuerpo de Bomberos de Barranquilla atendió la mañana de este viernes un incendio que se generó en el interior de una carpintería ubicada en la carrera 33 con calle 45, en el barrio Chiquinquirá.
Alberto Lobo Cepeda, de 66 años y dueño de la carpintería, señaló que la conflagración se originó cerca de las 7:45 de la mañana y al parecer su origen estaría relacionado con un corto circuito. Las llamas consumieron en su totalidad el local, 
Hasta el lugar de los hechos llegaron dos máquinas de bomberos con varios uniformados quienes, en cuestión de minutos, lograron sofocar las llamas y evitaron que se trasladara a casas vecinas.

 

 
“Hubo mucho temor por parte de los vecinos ya que las llamas alcanzaron grandes alturas y el material que estaba en el interior de la carpintería era muy inflamable. Había por supuesto mucha madera, pinturas, espuma de mueblería, telas y demás químicos”, contó un testigo a este medio.
Otras personas indicaron que el humo, debido a que era muy tóxico, afectó a varios adultos mayores y niños, por lo que fueron atendidos por varios paramédicos.
Por su parte, Lobo Cepeda, el dueño del local, calcula que las pérdidas materiales, entre muebles y maquinaria, están valoradas en casi 300 millones de pesos.
El reporte fue enviado a través de la línea Wasapea a EL HERALDO.",2020-07-31 16:30:39+00:00,https://www.elheraldo.co/judicial/en-video-incendio-consume-una-carpinteria-en-chiquinquira-746859,Judicial,El Heraldo
27,35,Más personas tendrían nexos con el crimen del abogado en Cartagena: Policía  | El Heraldo,"Como José Luis Pastrana Llanos, alias el Pastrana, de 27 años,  y Erick Andrés Berrio Espitia, alias el Pichui, de 28 años, fueron identificados los dos hombres que fueron capturados la tarde del jueves en Cartagena, por ser presuntamente autores materiales del asesinato de Sergio Andrés Díaz Barrios, un abogado, registrador auxiliar de la ciudad, en hechos ocurridos el pasado 16 de julio, en el barrio Los Alpes, en el suroriente de la capital de Bolívar.
En rueda de prensa la mañana de este viernes, alcalde de Cartagena, William Dau Chamat y el comandante de la Mecar, general Henry Sanabria Cely, ofrecieron  detalles de la investigación que llevó a la captura de los hombres.
En la intervención, el alto oficial señaló  que los móviles del homicidio no fue el atraco, sino que estaría relacionado “con la actividad que desarrollaba el abogado”
“Se analizaron los videos y se observa como el conductor de la moto obtiene un elemento en específico. Así mismo, se continúa con las investigaciones para establecer con certeza la identidad de las personas que habrían coparticipado en el homicidio, en calidad de determinadores, por cuanto más allá del hurto existiría un móvil distinto que involucraría otras personas”, detalló el general Sanabria.
Por su parte, el mandatario cartagenero destacó que las acciones de captura se lograron “por la participación de la comunidad que fue vital para dar con los perpetradores”.
En operativos simultáneos, ejecutados en vías principales de los barrios 13 de junio y el sector El Porvenir del barrio Olaya Herrera, policías de la Seccional de Investigación Criminal e Interpol, bajo la coordinación de la Fiscalía 51 Seccional URI, fueron quienes lograron la captura.
“Las labores investigativas, recolección de información, elementos materiales probatorios y análisis de videos de cámaras de seguridad, fueron suficientes para que se expidieran por parte del juzgado 16 Penal Municipal con funciones de control de garantías, las órdenes de captura en contra de los hombres, quienes serían los autores del homicidio”, señaló la institución en un comunicado. .
‘El Pastrana’ y  ‘Pichui’ fueron puestos a disposición de la Fiscalía, para iniciar las audiencias preliminares ante un juez de control de garantías.",2020-07-31 17:10:45+00:00,https://www.elheraldo.co/judicial/mas-personas-tendrian-nexos-con-el-crimen-del-abogado-en-cartagena-policia-746866,Judicial,El Heraldo
28,36,De la coca a la iraca: un nuevo camino para Colombia,La iraca es opción para comunidades que buscan alternativas para sustitución de cultivos ilícitos.,2020-07-31 20:04:05+00:00,https://www.eltiempo.com/justicia/conflicto-y-narcotrafico/por-que-la-iraca-es-una-opcion-para-sustitucion-de-cultivos-ilicitos-524616,Conflicto y Narcotráfico,El Tiempo
29,37,Tres muertos y tres heridos deja explosión de campo minado en Putumayo,El hecho se presentó mientras cumplían labores de erradicación de cultivos ilícitos.,2020-07-30 18:11:08+00:00,https://www.eltiempo.com/justicia/conflicto-y-narcotrafico/varios-muertos-por-minas-en-putumayo-mientras-erradicaban-cultivos-ilicitos-524082,Conflicto y Narcotráfico,El Tiempo
30,38,Las lecciones de la justicia para juzgar a los paramilitares,Fue el primer modelo transicional en el país y ahora cumple 15 años. ¿Qué ha logrado y qué le falta?,2020-07-30 17:02:46+00:00,https://www.eltiempo.com/justicia/conflicto-y-narcotrafico/especial-balance-de-los-15-anos-del-proceso-de-justicia-y-paz-524104,Conflicto y Narcotráfico,El Tiempo
31,39,La pelea familiar por 14 bienes que habrían servido a ‘paras’,"Justicia y Paz mantuvo medidas cautelares sobre estos, que habrían servido a Hernán Giraldo Serna.",2020-07-30 15:22:29+00:00,https://www.eltiempo.com/justicia/conflicto-y-narcotrafico/familia-busca-recuperar-bienes-que-sirvieron-a-hernan-giraldo-en-santa-marta-523982,Conflicto y Narcotráfico,El Tiempo
32,40,Bienes que aportaron ex-Auc solo alcanzan para medio año de reparación,En el Fondo de Reparación hay bienes que cuestan casi medio billón de pesos.,2020-07-30 01:57:06+00:00,https://www.eltiempo.com/justicia/conflicto-y-narcotrafico/balance-de-los-bienes-que-entregaron-los-paramilitares-para-reparar-a-las-victimas-523832,Conflicto y Narcotráfico,El Tiempo
33,41,Francia Márquez y su lucha por defender el agua en Colombia,"Hace casi un año, la líder de las comunidades negras fue víctima de un intento de asesinato.",2020-07-29 21:35:53+00:00,https://www.eltiempo.com/justicia/conflicto-y-narcotrafico/francia-marquez-su-lucha-por-el-agua-en-colombia-523742,Conflicto y Narcotráfico,El Tiempo
34,42,Ni cirugía de cambio extremo salvó a capo 'Guacamayo' de la justicia,"Carlos José Robayo, quien hizo parte del cartel del Norte del Valle, remplazó a 'Martín Bala'.",2020-07-29 14:17:41+00:00,https://www.eltiempo.com/justicia/conflicto-y-narcotrafico/capturan-a-guacamayo-jefe-de-la-alianza-523464,Conflicto y Narcotráfico,El Tiempo
35,43,Norte de Santander desplazó a Nariño en cultivos de coca,"Mientras los cultivos ilícitos en Norte de Santander crecieron un 24 %, en Nariño bajaron un 12 %.",2020-07-29 03:36:43+00:00,https://www.eltiempo.com/justicia/conflicto-y-narcotrafico/balance-de-los-departamentos-con-mas-cultivos-de-coca-en-colombia-523402,Conflicto y Narcotráfico,El Tiempo
36,44,En cuatro departamentos se concentra el 78 % de los cultivos de coca,ONU presentó su informe completo sobre la situación de Colombia en producción de cocaína.,2020-07-29 01:57:33+00:00,https://www.eltiempo.com/justicia/conflicto-y-narcotrafico/cultivos-de-coca-en-cuatro-departamentos-se-concentran-mas-de-100-mil-hectareas-sembradas-523178,Conflicto y Narcotráfico,El Tiempo
37,45,"Las deudas y aciertos de Justicia y Paz, a 15 años de su creación",El proceso que permitió develar gran parte del horror paramilitar está lejos de cerrarse.,2020-07-28 16:21:31+00:00,https://www.eltiempo.com/justicia/conflicto-y-narcotrafico/balance-de-los-15-anos-de-la-ley-de-justicia-y-paz-que-juzgo-a-los-paramilitares-522192,Conflicto y Narcotráfico,El Tiempo
38,46,El grito que retumba en las redes a favor de Brenda Pájaro  | El Heraldo,"#YoSoyBrendaPájaro. Esa ha sido la etiqueta con la que en las últimas semanas colectivos feministas, organizaciones y sociedad civil buscan mantener a flote el caso de la mujer de 44 años que el 25 de julio de 2018 fue reportada como desaparecida y que 33 días después fue hallada muerta  en un sector enmontado del barrio Miramar, con signos de haber sido abusada sexualmente.
El caso tomó relevancia la semana pasada cuando el Juez 17 Penal Municipal con función de Control de Garantías de Barranquilla concedió la libertad, al levantar la medida se aseguramiento, que mantenía en prisión a Tomás Maldonado Cera, alias el Satánico, quien es acusado  por el delito de feminicidio en concurso con acceso carnal violento agravado y hurto.
La Fiscalía lo señaló como el principal sospechoso del homicidio de Brenda, luego de quedar registrado en cámaras de seguridad de un conjunto residencial de Miramar. 
La etiqueta que se comenzó a utilizar con fuerza el pasado 22 de julio y con corte hasta ayer había sido utilizado en 406 trinos en la red social Twitter, siendo los días 26 y 27 cuando más fue ‘trinado’. Según las estadísticas de la red, la etiqueta ha tenido 907.253 “impactos potenciales” y el alcance se prevé que ha llegado a 636.100 cuentas.
Los impulsadores
Sin duda, es la hija de Brenda Pájaro, Gisella Durán, quien más se ha activado en las diferentes plataformas para buscar justicia y no dejar que el caso de su progenitora quede en la impunidad.
La joven de  27 años, en compañía de varias amigas, postea a diario mensajes e información relacionada con el caso.
El Comité de Solidaridad con los Presos Políticos, como representante de víctimas dentro del proceso que se sigue por el feminicidio de Pájaro Bruno, también ha sido una de las organizaciones que ha estado moviendo el caso en las redes sociales, y fue las primeras que sentó posición ante la decisión del juez, al señalar que la medida “visibiliza, una vez más, la falta de garantías que tienen las víctimas de feminicidio en el Sistema Penal colombiano”.
“El Juez no tuvo en cuenta los requisitos que exige la Ley para tomar la decisión, desconociendo, entre otras cosas, que alias el “Satánico” ha sido investigado en por lo menos 9 ocasiones por hechos donde las víctimas lo identifican por ser la última persona con las que estuvieron sus familiares antes de desaparecer, lo que demandaba un mayor esfuerzo por parte del Juez al momento de revisar los requisitos que exige la Ley para levantar la medida de aseguramiento”, señaló la organización en un comunicado.
Por su parte, Dayana De la Rosa Carbonell, investigadora del grupo Mujer, Género y Cultura de la Universidad del Atlántico, suscribió un comunicado del Movimiento Amplio de Mujeres en el Atlántico que fue difundido por redes sociales donde destacan “el trato diferente” que reciben los casos de violencia y crueldad  contra las mujeres y los cuerpos feminizados que “develan las barreras y zancadillas  en el acceso a la justicia para las mujeres, sus familias, comunidades y sociedad en general”.
Una opinión
Pero De la Rosa tiene una opinión más personal. Para ella Colombia al ser un Estado que garantiza los derechos del victimario “se olvida a veces en la perspectiva y olvida los derechos de la víctima”.
“Creo que hace falta como una conciencia por parte de los administradores de justicia para poder aplicar la norma como se debe. Nos da la sensación de que cuando son feminicidios,  el sistema judicial es lento y eso da la sensación de que no hay aplicación de la justicia. Esto es una mala señal que se le envía a la sociedad”, expresó De la Rosa.
Según el Observatorio de Feminicidios Colombia, en lo que va corrido del año 241 mujeres han sido víctimas de feminicidio en nuestro país, y durante el periodo de cuarentena por la COVID– 19, se conocen 169 casos de este crimen de odio.  La violencia patriarcal contra las mujeres no puede seguir siendo tratado como un tema menor dentro del Sistema Penal colombiano
Para ayer estaba programada  la continuación del juicio oral virtual contra Maldonado, pero fue aplazada para el 6 de agosto debido a que sus abogados no se conectaron a la diligencia que se daría de forma virtual.",2020-07-31 22:35:37+00:00,https://www.elheraldo.co/judicial/el-grito-que-retumba-en-las-redes-favor-de-brenda-pajaro-746965,Judicial,El Heraldo
39,47,¿Qué pasará con Ramón Navarro? Juez no dio su veredicto | El Heraldo,"Si no fuera por la decisión del juez de suspender la audiencia que se llevaba a cabo la tarde de este viernes, ya se sabría el contenido del fallo condenatorio contra Ramón Navarro en el proceso por el desfalco de más de 27 mil millones de pesos de Triple A.
El togado no entregó su veredicto durante la audiencia virtual y ahora hay que esperar a que se programe una nueva diligencia en la que finalmente se haga la lectura del fallo. 
Navarro se había allanado a los cargos por enriquecimiento ilícito, falsedad en documento privado y administración desleal que le endilgó la Fiscalía y ya el juez encargado del caso validó esa aceptación de culpabilidad por parte del sindicado. 
Ahora, la defensa de Triple A busca el resarcimiento de daños causados por una suma que podría alcanzar los 30 mil millones de pesos.
Ramón Navarro actualmente se encuentra cobijado con medida de aseguramiento preventivo con el beneficio de casa por cárcel.",2020-08-01 03:14:26+00:00,https://www.elheraldo.co/judicial/que-pasara-con-ramon-navarro-juez-no-dio-su-veredicto-747051,Judicial,El Heraldo
40,48,A balas asesinan a dos hombres en Puerto Colombia | El Heraldo,"Hacia las 7:20 de la noche de este viernes dos hombres, que aún no han sido identificados por las autoridades, fueron asesinados a bala en la calle 3B con carrera 39, barrio Sol y Mar, corregimiento de Salgar, Puerto Colombia. 
Según el reporte preliminar de la Policía, una de las víctimas es de contextura gruesa, tez trigueña, y de aproximadamente 25 años. “El hombre viste pantalón jeans color azul y suéter color rojo y registra un impacto de bala en la cabeza”.
En cuanto a la otra víctima, las autoridades describen que es de contextura gruesa, tez morena, y de aproximadamente 28 años. 
“Esta persona viste pantalón jeans color azul y suéter de colores verde y blanco. El cuerpo presenta también un disparo en la cabeza”, detalló el reporte. 
 
Según la comunidad, a esa hora escucharon los disparos y es por eso que dieron aviso a las autoridades. 
“La patrulla del cuadrante llega al lugar y encuentra los cuerpos tendidos sin signos vitales en un sector enmontado”, contó un testigo y añadió que los agresores se dieron a la huida en una moto negra. 
Tras el hallazgo, la zona fue acordonada por la Policía hasta la llegada de los agentes forenses quienes realizaron el levantamiento de los cuerpos.",2020-08-01 02:37:58+00:00,https://www.elheraldo.co/judicial/balas-asesinan-dos-hombres-en-puerto-colombia-747030,Judicial,El Heraldo
41,49,Sicarios matan de 4 disparos a cobradiario en Las Malvinas | El Heraldo,"¡Las Malvinas amaneció caliente! Esa fue la frase que soltó un testigo que observó el asesinato de  Edinson Yofreseen Vergara De Ávila, 29 años, la mañana de este sábado en ese barrio del suroccidente de Barranquilla.
Contó el testigo, que la víctima, quien se desempañaban como cobradiario, se encontraba en las afueras de una casa en la carrera 7 con calle 98, cuando dos hombres lo abordaron, siendo el parrillero quien sacó el arma y disparó en cuatro oportunidades.
“Edinson estaba allí sentado, mirando hacia la cancha cuando llegaron los tipos y le dispararon a la altura de la cabeza y salieron volando del lugar”, relató el testigo.  
La víctima recibió los impactos de bala en la cabeza, y en el brazo derecho. Allí familiares y vecinos lo trasladaron hasta las instalaciones de la clínica San Ignacio donde falleció en momentos en los que  cuando recibía atención médica.
Según la Policía el hombre no tiene registro de antecedentes en el aplicativo de Seguimiento y Control de Caos (SECAD); sin embargo, está pendiente reporte de Policía Judicial por el SPOA.
Los homicidas se transportaban en una motocicleta TVS, color negro, “Se alertaron las unidades en servicio para dar con la búsqueda y captura del sujeto responsable del hecho”, detalló la institución en su reporte preliminar.
La inspección técnica de cadáver estuvo a cargo de los agentes del CTI.",2020-08-01 17:19:03+00:00,https://www.elheraldo.co/judicial/sicarios-matan-de-4-disparos-cobradiario-en-las-malvinas-747141,Judicial,El Heraldo
